No.     Time           Source                Destination           Protocol Length Info
      1 0.000000000    122.121.86.33         192.168.1.129         UDP      157    Source port: 7849  Destination port: 26714

Frame 1: 157 bytes on wire (1256 bits), 157 bytes captured (1256 bits) on interface 0
Ethernet II, Src: Cisco-Li_eb:0a:d9 (20:aa:4b:eb:0a:d9), Dst: IntelCor_40:cb:03 (f8:16:54:40:cb:03)
Internet Protocol Version 4, Src: 122.121.86.33 (122.121.86.33), Dst: 192.168.1.129 (192.168.1.129)
    Version: 4
    Header Length: 20 bytes
    Differentiated Services Field: 0x20 (DSCP 0x08: Class Selector 1; ECN: 0x00: Not-ECT (Not ECN-Capable Transport))
    Total Length: 143
    Identification: 0x50ac (20652)
    Flags: 0x00
    Fragment offset: 0
    Time to live: 115
    Protocol: UDP (17)
    Header checksum: 0x63ce [validation disabled]
    Source: 122.121.86.33 (122.121.86.33)
    Destination: 192.168.1.129 (192.168.1.129)
    [Source GeoIP: Unknown]
    [Destination GeoIP: Unknown]
User Datagram Protocol, Src Port: 7849 (7849), Dst Port: 26714 (26714)
Data (115 bytes)

0000  64 31 3a 61 64 32 3a 69 64 32 30 3a 45 6a 34 8b   d1:ad2:id20:Ej4.
0010  11 1c ab ac f4 9e 7e c7 c6 dd b3 5f a5 81 d1 c2   ......~...._....
0020  39 3a 69 6e 66 6f 5f 68 61 73 68 32 30 3a 4b 40   9:info_hash20:K@
0030  b1 4a 74 06 1a c7 e6 34 76 e9 07 3d b6 9e 85 5f   .Jt....4v..=..._
0040  68 3f 36 3a 6e 6f 73 65 65 64 69 31 65 65 31 3a   h?6:noseedi1ee1:
0050  71 39 3a 67 65 74 5f 70 65 65 72 73 31 3a 74 32   q9:get_peers1:t2
0060  3a bb de 31 3a 76 34 3a 4c 54 01 00 31 3a 79 31   :..1:v4:LT..1:y1
0070  3a 71 65                                          :qe

No.     Time           Source                Destination           Protocol Length Info
      2 0.000203000    192.168.1.129         122.121.86.33         UDP      769    Source port: 26714  Destination port: 7849

Frame 2: 769 bytes on wire (6152 bits), 769 bytes captured (6152 bits) on interface 0
Ethernet II, Src: IntelCor_40:cb:03 (f8:16:54:40:cb:03), Dst: Cisco-Li_eb:0a:d9 (20:aa:4b:eb:0a:d9)
Internet Protocol Version 4, Src: 192.168.1.129 (192.168.1.129), Dst: 122.121.86.33 (122.121.86.33)
    Version: 4
    Header Length: 20 bytes
    Differentiated Services Field: 0x00 (DSCP 0x00: Default; ECN: 0x00: Not-ECT (Not ECN-Capable Transport))
    Total Length: 755
    Identification: 0x1f26 (7974)
    Flags: 0x00
    Fragment offset: 0
    Time to live: 128
    Protocol: UDP (17)
    Header checksum: 0x8610 [validation disabled]
    Source: 192.168.1.129 (192.168.1.129)
    Destination: 122.121.86.33 (122.121.86.33)
    [Source GeoIP: Unknown]
    [Destination GeoIP: Unknown]
User Datagram Protocol, Src Port: 26714 (26714), Dst Port: 7849 (7849)
Data (727 bytes)

0000  64 32 3a 69 70 36 3a 7a 79 56 21 1e a9 31 3a 72   d2:ip6:zyV!..1:r
0010  64 32 3a 69 64 32 30 3a 4b 40 b5 7d 49 dc ad 4f   d2:id20:K@.}I..O
0020  14 f2 44 40 66 d0 6b c4 30 b7 32 f6 35 3a 6e 6f   ..D@f.k.0.2.5:no
0030  64 65 73 32 30 38 3a 4b 40 b1 91 4c 80 78 b7 0b   des208:K@..L.x..
0040  8a bc 66 a8 96 1b dc c7 eb ce 49 47 33 f6 b4 c0   ..f.......IG3...
0050  dc 4b 40 b0 ee 65 99 2a d3 62 80 2c ef 02 14 78   .K@..e.*.b.,...x
0060  30 ee 36 6b cb 6c 04 9e 6d f3 8c 4b 40 b3 4e 3c   0.6k.l..m..K@.N<
0070  aa f7 fb 58 93 30 59 a9 78 90 9d 8a 71 de 7e 77   ...X.0Y.x...q.~w
0080  4a 45 b0 1a e9 4b 40 b2 47 90 07 9e 75 46 08 a7   JE...K@.G...uF..
0090  fe d0 78 3f 47 1f c7 31 e6 4d ac 43 67 c4 91 4b   ..x?G..1.M.Cg..K
00a0  40 b2 2a 1c 34 15 25 53 5a 7b a6 ef 69 ea cb 68   @.*.4.%SZ{..i..h
00b0  86 3d be 5d 4c c3 67 e5 f9 4b 40 b4 ec 7b fe 92   .=.]L.g..K@..{..
00c0  6c 4c d4 78 c6 5d 7f 11 66 7a 74 95 ae 73 ba 05   lL.x.]..fzt..s..
00d0  b0 cd c3 4b 40 b4 86 d8 f6 92 69 e7 64 5a 11 66   ...K@.....i.dZ.f
00e0  4d 13 3e 38 1b 8a a7 ab 61 a8 a1 b6 1f 4b 40 b4   M.>8....a....K@.
00f0  ae 16 f0 84 71 55 a4 fc 3a 95 a7 6b ad 38 dd 28   ....qU..:..k.8.(
0100  d6 59 9c 03 67 51 6b 35 3a 74 6f 6b 65 6e 32 30   .Y..gQk5:token20
0110  3a 5e fe b3 82 3b 11 bc 56 3d 3a 2b 47 93 55 6d   :^...;..V=:+G.Um
0120  71 27 80 9e f9 36 3a 76 61 6c 75 65 73 6c 36 3a   q'...6:valuesl6:
0130  31 9f 73 10 1f 48 36 3a 76 a6 f4 14 21 d2 36 3a   1.s..H6:v...!.6:
0140  72 2b f8 c1 04 26 36 3a da 23 c2 06 1c 3e 36 3a   r+...&6:.#...>6:
0150  24 e7 5e 87 24 ce 36 3a 01 ab e6 80 22 d0 36 3a   $.^.$.6:....".6:
0160  24 ee ee 51 05 b1 36 3a 01 af eb ef 22 46 36 3a   $..Q..6:...."F6:
0170  72 19 ef 99 21 a4 36 3a 7b cb 8b 94 04 00 36 3a   r...!.6:{.....6:
0180  7d e0 7c 5e 1d d9 36 3a 24 e8 4d 8d 24 58 36 3a   }.|^..6:$.M.$X6:
0190  af 89 0d 93 22 6f 36 3a 24 e9 2b d7 27 a9 36 3a   ...."o6:$.+.'.6:
01a0  77 4d ee be 22 e5 36 3a 24 e0 15 bb 1d 17 36 3a   wM..".6:$.....6:
01b0  6a 01 e7 3b 23 16 36 3a 7b cc 7f ba 25 d1 36 3a   j..;#.6:{...%.6:
01c0  70 68 55 32 1b d3 36 3a 2a 49 13 a1 91 c0 36 3a   phU2..6:*I....6:
01d0  da bb 55 8a 20 a4 36 3a cb 74 81 f3 21 b8 36 3a   ..U. .6:.t..!.6:
01e0  dc 84 6a ae 1b c4 36 3a 3d df 41 c9 1d 09 36 3a   ..j...6:=.A...6:
01f0  70 69 96 0c 1b b0 36 3a da ad 4b 15 04 09 36 3a   pi....6:..K...6:
0200  72 18 26 52 1e 7c 36 3a 67 03 c3 76 25 03 36 3a   r.&R.|6:g..v%.6:
0210  6f ff a8 ad 23 2f 36 3a 6f f8 44 0e 21 77 36 3a   o...#/6:o.D.!w6:
0220  73 a5 f8 55 67 5c 36 3a 24 ea 5a ca 22 d1 36 3a   s..Ug\6:$.Z.".6:
0230  7a 79 b8 92 26 5d 36 3a 24 ef ea cb 1e 50 36 3a   zy..&]6:$....P6:
0240  01 af 9f 47 13 ea 36 3a 3b 66 91 f9 1f b8 36 3a   ...G..6:;f....6:
0250  6f fb c7 4b 23 a4 36 3a df 13 bd 6e 26 3f 36 3a   o..K#.6:...n&?6:
0260  3d 3a 48 e2 21 ec 36 3a 6f f3 11 71 22 c3 36 3a   =:H.!.6:o..q".6:
0270  24 eb 0e 5f 21 c3 36 3a df 8b 87 f2 6b 87 36 3a   $.._!.6:....k.6:
0280  24 e7 5d 02 11 fc 36 3a 24 e4 b4 1e 07 b5 36 3a   $.]...6:$.....6:
0290  24 ea 7e 37 05 68 36 3a 72 19 fe 23 22 32 36 3a   $.~7.h6:r..#"26:
02a0  24 ee ee 51 1d ac 36 3a 3d e6 74 ac 27 98 36 3a   $..Q..6:=.t.'.6:
02b0  24 e7 5e 87 07 25 36 3a 24 ea ad 35 22 0c 65 65   $.^..%6:$..5".ee
02c0  31 3a 74 32 3a bb de 31 3a 76 34 3a 55 54 a1 9d   1:t2:..1:v4:UT..
02d0  31 3a 79 31 3a 72 65                              1:y1:re

No.     Time           Source                Destination           Protocol Length Info
      3 0.124218000    2400:cb00:2048:1::6819:a06 2601:1c0:8201:853a:653f:b917:f053:1000 TLSv1.2  105    Encrypted Alert

Frame 3: 105 bytes on wire (840 bits), 105 bytes captured (840 bits) on interface 0
Ethernet II, Src: Cisco-Li_eb:0a:d9 (20:aa:4b:eb:0a:d9), Dst: IntelCor_40:cb:03 (f8:16:54:40:cb:03)
Internet Protocol Version 6, Src: 2400:cb00:2048:1::6819:a06 (2400:cb00:2048:1::6819:a06), Dst: 2601:1c0:8201:853a:653f:b917:f053:1000 (2601:1c0:8201:853a:653f:b917:f053:1000)
Transmission Control Protocol, Src Port: 443 (443), Dst Port: 49827 (49827), Seq: 1, Ack: 1, Len: 31
Secure Sockets Layer

No.     Time           Source                Destination           Protocol Length Info
      4 0.124294000    2601:1c0:8201:853a:653f:b917:f053:1000 2400:cb00:2048:1::6819:a06 TCP      74     49827→443 [ACK] Seq=1 Ack=32 Win=252 Len=0

Frame 4: 74 bytes on wire (592 bits), 74 bytes captured (592 bits) on interface 0
Ethernet II, Src: IntelCor_40:cb:03 (f8:16:54:40:cb:03), Dst: Cisco-Li_eb:0a:d9 (20:aa:4b:eb:0a:d9)
Internet Protocol Version 6, Src: 2601:1c0:8201:853a:653f:b917:f053:1000 (2601:1c0:8201:853a:653f:b917:f053:1000), Dst: 2400:cb00:2048:1::6819:a06 (2400:cb00:2048:1::6819:a06)
Transmission Control Protocol, Src Port: 49827 (49827), Dst Port: 443 (443), Seq: 1, Ack: 32, Len: 0

No.     Time           Source                Destination           Protocol Length Info
      5 0.125402000    2400:cb00:2048:1::6819:a06 2601:1c0:8201:853a:653f:b917:f053:1000 TCP      74     443→49827 [FIN, ACK] Seq=32 Ack=1 Win=29 Len=0

Frame 5: 74 bytes on wire (592 bits), 74 bytes captured (592 bits) on interface 0
Ethernet II, Src: Cisco-Li_eb:0a:d9 (20:aa:4b:eb:0a:d9), Dst: IntelCor_40:cb:03 (f8:16:54:40:cb:03)
Internet Protocol Version 6, Src: 2400:cb00:2048:1::6819:a06 (2400:cb00:2048:1::6819:a06), Dst: 2601:1c0:8201:853a:653f:b917:f053:1000 (2601:1c0:8201:853a:653f:b917:f053:1000)
Transmission Control Protocol, Src Port: 443 (443), Dst Port: 49827 (49827), Seq: 32, Ack: 1, Len: 0

No.     Time           Source                Destination           Protocol Length Info
      6 0.125478000    2601:1c0:8201:853a:653f:b917:f053:1000 2400:cb00:2048:1::6819:a06 TCP      74     [TCP Dup ACK 4#1] 49827→443 [ACK] Seq=1 Ack=32 Win=252 Len=0

Frame 6: 74 bytes on wire (592 bits), 74 bytes captured (592 bits) on interface 0
Ethernet II, Src: IntelCor_40:cb:03 (f8:16:54:40:cb:03), Dst: Cisco-Li_eb:0a:d9 (20:aa:4b:eb:0a:d9)
Internet Protocol Version 6, Src: 2601:1c0:8201:853a:653f:b917:f053:1000 (2601:1c0:8201:853a:653f:b917:f053:1000), Dst: 2400:cb00:2048:1::6819:a06 (2400:cb00:2048:1::6819:a06)
Transmission Control Protocol, Src Port: 49827 (49827), Dst Port: 443 (443), Seq: 1, Ack: 32, Len: 0

No.     Time           Source                Destination           Protocol Length Info
      7 0.125585000    2601:1c0:8201:853a:653f:b917:f053:1000 2400:cb00:2048:1::6819:a06 TCP      74     49827→443 [ACK] Seq=1 Ack=33 Win=252 Len=0

Frame 7: 74 bytes on wire (592 bits), 74 bytes captured (592 bits) on interface 0
Ethernet II, Src: IntelCor_40:cb:03 (f8:16:54:40:cb:03), Dst: Cisco-Li_eb:0a:d9 (20:aa:4b:eb:0a:d9)
Internet Protocol Version 6, Src: 2601:1c0:8201:853a:653f:b917:f053:1000 (2601:1c0:8201:853a:653f:b917:f053:1000), Dst: 2400:cb00:2048:1::6819:a06 (2400:cb00:2048:1::6819:a06)
Transmission Control Protocol, Src Port: 49827 (49827), Dst Port: 443 (443), Seq: 1, Ack: 33, Len: 0

No.     Time           Source                Destination           Protocol Length Info
      8 0.771493000    fe80::810b:10f:40b7:c58f ff02::c               SSDP     208    M-SEARCH * HTTP/1.1 

Frame 8: 208 bytes on wire (1664 bits), 208 bytes captured (1664 bits) on interface 0
Ethernet II, Src: IntelCor_40:cb:03 (f8:16:54:40:cb:03), Dst: IPv6mcast_0c (33:33:00:00:00:0c)
Internet Protocol Version 6, Src: fe80::810b:10f:40b7:c58f (fe80::810b:10f:40b7:c58f), Dst: ff02::c (ff02::c)
User Datagram Protocol, Src Port: 53709 (53709), Dst Port: 1900 (1900)
Hypertext Transfer Protocol

No.     Time           Source                Destination           Protocol Length Info
      9 1.879602000    112.105.150.12        192.168.1.129         UDP      157    Source port: 7088  Destination port: 26714

Frame 9: 157 bytes on wire (1256 bits), 157 bytes captured (1256 bits) on interface 0
Ethernet II, Src: Cisco-Li_eb:0a:d9 (20:aa:4b:eb:0a:d9), Dst: IntelCor_40:cb:03 (f8:16:54:40:cb:03)
Internet Protocol Version 4, Src: 112.105.150.12 (112.105.150.12), Dst: 192.168.1.129 (192.168.1.129)
    Version: 4
    Header Length: 20 bytes
    Differentiated Services Field: 0x20 (DSCP 0x08: Class Selector 1; ECN: 0x00: Not-ECT (Not ECN-Capable Transport))
    Total Length: 143
    Identification: 0x4b20 (19232)
    Flags: 0x00
    Fragment offset: 0
    Time to live: 109
    Protocol: UDP (17)
    Header checksum: 0x397f [validation disabled]
    Source: 112.105.150.12 (112.105.150.12)
    Destination: 192.168.1.129 (192.168.1.129)
    [Source GeoIP: Unknown]
    [Destination GeoIP: Unknown]
User Datagram Protocol, Src Port: 7088 (7088), Dst Port: 26714 (26714)
Data (115 bytes)

0000  64 31 3a 61 64 32 3a 69 64 32 30 3a b2 bd c2 a9   d1:ad2:id20:....
0010  d8 ff 6e cf f2 f5 3e 2b 84 cd 74 c8 e3 c2 81 d3   ..n...>+..t.....
0020  39 3a 69 6e 66 6f 5f 68 61 73 68 32 30 3a 4b 40   9:info_hash20:K@
0030  b1 4a 74 06 1a c7 e6 34 76 e9 07 3d b6 9e 85 5f   .Jt....4v..=..._
0040  68 3f 36 3a 6e 6f 73 65 65 64 69 31 65 65 31 3a   h?6:noseedi1ee1:
0050  71 39 3a 67 65 74 5f 70 65 65 72 73 31 3a 74 32   q9:get_peers1:t2
0060  3a 1f a2 31 3a 76 34 3a 4c 54 01 00 31 3a 79 31   :..1:v4:LT..1:y1
0070  3a 71 65                                          :qe

No.     Time           Source                Destination           Protocol Length Info
     10 1.879785000    192.168.1.129         112.105.150.12        UDP      769    Source port: 26714  Destination port: 7088

Frame 10: 769 bytes on wire (6152 bits), 769 bytes captured (6152 bits) on interface 0
Ethernet II, Src: IntelCor_40:cb:03 (f8:16:54:40:cb:03), Dst: Cisco-Li_eb:0a:d9 (20:aa:4b:eb:0a:d9)
Internet Protocol Version 4, Src: 192.168.1.129 (192.168.1.129), Dst: 112.105.150.12 (112.105.150.12)
    Version: 4
    Header Length: 20 bytes
    Differentiated Services Field: 0x00 (DSCP 0x00: Default; ECN: 0x00: Not-ECT (Not ECN-Capable Transport))
    Total Length: 755
    Identification: 0x1f27 (7975)
    Flags: 0x00
    Fragment offset: 0
    Time to live: 128
    Protocol: UDP (17)
    Header checksum: 0x5034 [validation disabled]
    Source: 192.168.1.129 (192.168.1.129)
    Destination: 112.105.150.12 (112.105.150.12)
    [Source GeoIP: Unknown]
    [Destination GeoIP: Unknown]
User Datagram Protocol, Src Port: 26714 (26714), Dst Port: 7088 (7088)
Data (727 bytes)

0000  64 32 3a 69 70 36 3a 70 69 96 0c 1b b0 31 3a 72   d2:ip6:pi....1:r
0010  64 32 3a 69 64 32 30 3a 4b 40 b5 7d 49 dc ad 4f   d2:id20:K@.}I..O
0020  14 f2 44 40 66 d0 6b c4 30 b7 32 f6 35 3a 6e 6f   ..D@f.k.0.2.5:no
0030  64 65 73 32 30 38 3a 4b 40 b1 91 4c 80 78 b7 0b   des208:K@..L.x..
0040  8a bc 66 a8 96 1b dc c7 eb ce 49 47 33 f6 b4 c0   ..f.......IG3...
0050  dc 4b 40 b0 ee 65 99 2a d3 62 80 2c ef 02 14 78   .K@..e.*.b.,...x
0060  30 ee 36 6b cb 6c 04 9e 6d f3 8c 4b 40 b3 4e 3c   0.6k.l..m..K@.N<
0070  aa f7 fb 58 93 30 59 a9 78 90 9d 8a 71 de 7e 77   ...X.0Y.x...q.~w
0080  4a 45 b0 1a e9 4b 40 b2 47 90 07 9e 75 46 08 a7   JE...K@.G...uF..
0090  fe d0 78 3f 47 1f c7 31 e6 4d ac 43 67 c4 91 4b   ..x?G..1.M.Cg..K
00a0  40 b2 2a 1c 34 15 25 53 5a 7b a6 ef 69 ea cb 68   @.*.4.%SZ{..i..h
00b0  86 3d be 5d 4c c3 67 e5 f9 4b 40 b4 ec 7b fe 92   .=.]L.g..K@..{..
00c0  6c 4c d4 78 c6 5d 7f 11 66 7a 74 95 ae 73 ba 05   lL.x.]..fzt..s..
00d0  b0 cd c3 4b 40 b4 86 d8 f6 92 69 e7 64 5a 11 66   ...K@.....i.dZ.f
00e0  4d 13 3e 38 1b 8a a7 ab 61 a8 a1 b6 1f 4b 40 b4   M.>8....a....K@.
00f0  ae 16 f0 84 71 55 a4 fc 3a 95 a7 6b ad 38 dd 28   ....qU..:..k.8.(
0100  d6 59 9c 03 67 51 6b 35 3a 74 6f 6b 65 6e 32 30   .Y..gQk5:token20
0110  3a 4d 39 d6 76 03 3b de fb 5e a6 6c f9 06 18 b4   :M9.v.;..^.l....
0120  9f 14 ae a8 d9 36 3a 76 61 6c 75 65 73 6c 36 3a   .....6:valuesl6:
0130  31 9f 73 10 1f 48 36 3a 76 a6 f4 14 21 d2 36 3a   1.s..H6:v...!.6:
0140  72 2b f8 c1 04 26 36 3a da 23 c2 06 1c 3e 36 3a   r+...&6:.#...>6:
0150  24 e7 5e 87 24 ce 36 3a 01 ab e6 80 22 d0 36 3a   $.^.$.6:....".6:
0160  24 ee ee 51 05 b1 36 3a 01 af eb ef 22 46 36 3a   $..Q..6:...."F6:
0170  72 19 ef 99 21 a4 36 3a 7b cb 8b 94 04 00 36 3a   r...!.6:{.....6:
0180  7d e0 7c 5e 1d d9 36 3a 24 e8 4d 8d 24 58 36 3a   }.|^..6:$.M.$X6:
0190  af 89 0d 93 22 6f 36 3a 24 e9 2b d7 27 a9 36 3a   ...."o6:$.+.'.6:
01a0  77 4d ee be 22 e5 36 3a 24 e0 15 bb 1d 17 36 3a   wM..".6:$.....6:
01b0  6a 01 e7 3b 23 16 36 3a 7b cc 7f ba 25 d1 36 3a   j..;#.6:{...%.6:
01c0  70 68 55 32 1b d3 36 3a 2a 49 13 a1 91 c0 36 3a   phU2..6:*I....6:
01d0  da bb 55 8a 20 a4 36 3a cb 74 81 f3 21 b8 36 3a   ..U. .6:.t..!.6:
01e0  dc 84 6a ae 1b c4 36 3a 3d df 41 c9 1d 09 36 3a   ..j...6:=.A...6:
01f0  70 69 96 0c 1b b0 36 3a da ad 4b 15 04 09 36 3a   pi....6:..K...6:
0200  72 18 26 52 1e 7c 36 3a 67 03 c3 76 25 03 36 3a   r.&R.|6:g..v%.6:
0210  6f ff a8 ad 23 2f 36 3a 6f f8 44 0e 21 77 36 3a   o...#/6:o.D.!w6:
0220  73 a5 f8 55 67 5c 36 3a 24 ea 5a ca 22 d1 36 3a   s..Ug\6:$.Z.".6:
0230  7a 79 b8 92 26 5d 36 3a 24 ef ea cb 1e 50 36 3a   zy..&]6:$....P6:
0240  01 af 9f 47 13 ea 36 3a 3b 66 91 f9 1f b8 36 3a   ...G..6:;f....6:
0250  6f fb c7 4b 23 a4 36 3a df 13 bd 6e 26 3f 36 3a   o..K#.6:...n&?6:
0260  3d 3a 48 e2 21 ec 36 3a 6f f3 11 71 22 c3 36 3a   =:H.!.6:o..q".6:
0270  24 eb 0e 5f 21 c3 36 3a df 8b 87 f2 6b 87 36 3a   $.._!.6:....k.6:
0280  24 e7 5d 02 11 fc 36 3a 24 e4 b4 1e 07 b5 36 3a   $.]...6:$.....6:
0290  24 ea 7e 37 05 68 36 3a 72 19 fe 23 22 32 36 3a   $.~7.h6:r..#"26:
02a0  24 ee ee 51 1d ac 36 3a 3d e6 74 ac 27 98 36 3a   $..Q..6:=.t.'.6:
02b0  24 e7 5e 87 07 25 36 3a 24 ea ad 35 22 0c 65 65   $.^..%6:$..5".ee
02c0  31 3a 74 32 3a 1f a2 31 3a 76 34 3a 55 54 a1 9d   1:t2:..1:v4:UT..
02d0  31 3a 79 31 3a 72 65                              1:y1:re

No.     Time           Source                Destination           Protocol Length Info
     11 2.778984000    192.168.1.129         79.181.144.231        UDP      145    Source port: 26714  Destination port: 11888

Frame 11: 145 bytes on wire (1160 bits), 145 bytes captured (1160 bits) on interface 0
Ethernet II, Src: IntelCor_40:cb:03 (f8:16:54:40:cb:03), Dst: Cisco-Li_eb:0a:d9 (20:aa:4b:eb:0a:d9)
Internet Protocol Version 4, Src: 192.168.1.129 (192.168.1.129), Dst: 79.181.144.231 (79.181.144.231)
    Version: 4
    Header Length: 20 bytes
    Differentiated Services Field: 0x00 (DSCP 0x00: Default; ECN: 0x00: Not-ECT (Not ECN-Capable Transport))
    Total Length: 131
    Identification: 0x1f28 (7976)
    Flags: 0x00
    Fragment offset: 0
    Time to live: 128
    Protocol: UDP (17)
    Header checksum: 0x787c [validation disabled]
    Source: 192.168.1.129 (192.168.1.129)
    Destination: 79.181.144.231 (79.181.144.231)
    [Source GeoIP: Unknown]
    [Destination GeoIP: Unknown]
User Datagram Protocol, Src Port: 26714 (26714), Dst Port: 11888 (11888)
Data (103 bytes)

0000  64 31 3a 61 64 32 3a 69 64 32 30 3a 4b 40 b5 7d   d1:ad2:id20:K@.}
0010  49 dc ad 4f 14 f2 44 40 66 d0 6b c4 30 b7 32 f6   I..O..D@f.k.0.2.
0020  36 3a 74 61 72 67 65 74 32 30 3a 4b 44 00 1c 00   6:target20:KD...
0030  00 53 73 00 00 06 bb 00 00 3d ae 00 00 32 8d 65   .Ss......=...2.e
0040  31 3a 71 39 3a 66 69 6e 64 5f 6e 6f 64 65 31 3a   1:q9:find_node1:
0050  74 34 3a 60 62 00 00 31 3a 76 34 3a 55 54 a1 9d   t4:`b..1:v4:UT..
0060  31 3a 79 31 3a 71 65                              1:y1:qe

No.     Time           Source                Destination           Protocol Length Info
     12 2.781966000    69.181.214.27         192.168.1.129         UDP      179    Source port: 42012  Destination port: 26714

Frame 12: 179 bytes on wire (1432 bits), 179 bytes captured (1432 bits) on interface 0
Ethernet II, Src: Cisco-Li_eb:0a:d9 (20:aa:4b:eb:0a:d9), Dst: IntelCor_40:cb:03 (f8:16:54:40:cb:03)
Internet Protocol Version 4, Src: 69.181.214.27 (69.181.214.27), Dst: 192.168.1.129 (192.168.1.129)
    Version: 4
    Header Length: 20 bytes
    Differentiated Services Field: 0x20 (DSCP 0x08: Class Selector 1; ECN: 0x00: Not-ECT (Not ECN-Capable Transport))
    Total Length: 165
    Identification: 0x5790 (22416)
    Flags: 0x00
    Fragment offset: 0
    Time to live: 119
    Protocol: UDP (17)
    Header checksum: 0x0d9e [validation disabled]
    Source: 69.181.214.27 (69.181.214.27)
    Destination: 192.168.1.129 (192.168.1.129)
    [Source GeoIP: Unknown]
    [Destination GeoIP: Unknown]
User Datagram Protocol, Src Port: 42012 (42012), Dst Port: 26714 (26714)
Data (137 bytes)

0000  64 31 3a 61 64 32 3a 69 64 32 30 3a da c6 43 5d   d1:ad2:id20:..C]
0010  9a a9 5c 13 2d 0b 1b 61 de 69 f4 3c 5c fd 48 72   ..\.-..a.i.<\.Hr
0020  36 3a 74 61 72 67 65 74 32 30 3a 4b 40 b1 92 43   6:target20:K@..C
0030  35 d9 18 53 67 da 5a 49 5a 15 de 6c e8 ab e8 35   5..Sg.ZIZ..l...5
0040  3a 74 6f 6b 65 6e 32 30 3a d1 cb d4 b3 5d 62 63   :token20:....]bc
0050  c6 b6 91 88 b0 f8 0d 18 db cc b7 8b fe 34 3a 76   .............4:v
0060  6f 74 65 69 30 65 65 31 3a 71 34 3a 76 6f 74 65   otei0ee1:q4:vote
0070  31 3a 74 34 3a ed 33 00 00 31 3a 76 34 3a 55 54   1:t4:.3..1:v4:UT
0080  a1 9c 31 3a 79 31 3a 71 65                        ..1:y1:qe

No.     Time           Source                Destination           Protocol Length Info
     13 2.782155000    192.168.1.129         69.181.214.27         UDP      112    Source port: 26714  Destination port: 42012

Frame 13: 112 bytes on wire (896 bits), 112 bytes captured (896 bits) on interface 0
Ethernet II, Src: IntelCor_40:cb:03 (f8:16:54:40:cb:03), Dst: Cisco-Li_eb:0a:d9 (20:aa:4b:eb:0a:d9)
Internet Protocol Version 4, Src: 192.168.1.129 (192.168.1.129), Dst: 69.181.214.27 (69.181.214.27)
    Version: 4
    Header Length: 20 bytes
    Differentiated Services Field: 0x00 (DSCP 0x00: Default; ECN: 0x00: Not-ECT (Not ECN-Capable Transport))
    Total Length: 98
    Identification: 0x1f29 (7977)
    Flags: 0x00
    Fragment offset: 0
    Time to live: 128
    Protocol: UDP (17)
    Header checksum: 0x3d68 [validation disabled]
    Source: 192.168.1.129 (192.168.1.129)
    Destination: 69.181.214.27 (69.181.214.27)
    [Source GeoIP: Unknown]
    [Destination GeoIP: Unknown]
User Datagram Protocol, Src Port: 26714 (26714), Dst Port: 42012 (42012)
Data (70 bytes)

0000  64 32 3a 69 70 36 3a 45 b5 d6 1b a4 1c 31 3a 72   d2:ip6:E.....1:r
0010  64 32 3a 69 64 32 30 3a 4b 40 b5 7d 49 dc ad 4f   d2:id20:K@.}I..O
0020  14 f2 44 40 66 d0 6b c4 30 b7 32 f6 65 31 3a 74   ..D@f.k.0.2.e1:t
0030  34 3a ed 33 00 00 31 3a 76 34 3a 55 54 a1 9d 31   4:.3..1:v4:UT..1
0040  3a 79 31 3a 72 65                                 :y1:re

No.     Time           Source                Destination           Protocol Length Info
     14 3.393676000    79.181.144.231        192.168.1.129         UDP      341    Source port: 11888  Destination port: 26714

Frame 14: 341 bytes on wire (2728 bits), 341 bytes captured (2728 bits) on interface 0
Ethernet II, Src: Cisco-Li_eb:0a:d9 (20:aa:4b:eb:0a:d9), Dst: IntelCor_40:cb:03 (f8:16:54:40:cb:03)
Internet Protocol Version 4, Src: 79.181.144.231 (79.181.144.231), Dst: 192.168.1.129 (192.168.1.129)
    Version: 4
    Header Length: 20 bytes
    Differentiated Services Field: 0x20 (DSCP 0x08: Class Selector 1; ECN: 0x00: Not-ECT (Not ECN-Capable Transport))
    Total Length: 327
    Identification: 0x695e (26974)
    Flags: 0x00
    Fragment offset: 0
    Time to live: 111
    Protocol: UDP (17)
    Header checksum: 0x3e62 [validation disabled]
    Source: 79.181.144.231 (79.181.144.231)
    Destination: 192.168.1.129 (192.168.1.129)
    [Source GeoIP: Unknown]
    [Destination GeoIP: Unknown]
User Datagram Protocol, Src Port: 11888 (11888), Dst Port: 26714 (26714)
Data (299 bytes)

0000  64 32 3a 69 70 36 3a 43 aa 85 b0 68 5a 31 3a 72   d2:ip6:C...hZ1:r
0010  64 32 3a 69 64 32 30 3a 4b 45 02 b3 95 f4 17 48   d2:id20:KE.....H
0020  41 fa 86 71 de e0 2e ef a8 b8 11 3c 35 3a 6e 6f   A..q.......<5:no
0030  64 65 73 32 30 38 3a 4b 44 25 a3 24 8e 46 01 86   des208:KD%.$.F..
0040  23 00 5c 2d d8 45 14 9a c2 ab b3 53 8a fa 72 c4   #.\-.E.....S..r.
0050  91 4b 44 1c 02 1b 7c c5 ec 79 11 d6 d7 0d 9a a0   .KD...|..y......
0060  23 99 94 09 72 b9 72 b7 5f c8 d5 4b 44 57 79 9e   #...r.r._..KDWy.
0070  b1 a6 2a a9 7a cc 75 d1 25 a3 ae 2d 3e 12 27 51   ..*.z.u.%..->.'Q
0080  84 8a 07 5b 16 4b 44 3b 49 55 31 b3 74 af bf 0f   ...[.KD;IU1.t...
0090  73 cc 2e e2 9f 82 12 66 3b 54 9f d6 4f 21 ad 4b   s......f;T..O!.K
00a0  44 5a 31 b8 88 21 83 35 44 a5 fc c6 02 c6 ad 45   DZ1..!.5D......E
00b0  01 96 dd 7b 73 4b 95 2b 5d 4b 44 06 0f 87 54 67   ...{sK.+]KD...Tg
00c0  b9 a1 0d 01 73 82 ed 67 c9 e3 3d d8 95 d3 4c af   ....s..g..=...L.
00d0  a9 f2 31 4b 44 41 e1 6c d6 ae 52 90 49 f1 f1 bb   ..1KDA.l..R.I...
00e0  e9 eb b3 a6 db 3c be af 88 36 1b 9a 1d 4b 44 45   .....<...6...KDE
00f0  ed 23 98 46 ac 0c be 35 b7 eb 5f a5 5c fd 45 93   .#.F...5.._.\.E.
0100  f1 79 37 43 c8 1a e1 31 3a 70 69 32 36 37 31 34   .y7C...1:pi26714
0110  65 65 31 3a 74 34 3a 60 62 00 00 31 3a 76 34 3a   ee1:t4:`b..1:v4:
0120  4c 54 01 00 31 3a 79 31 3a 72 65                  LT..1:y1:re

No.     Time           Source                Destination           Protocol Length Info
     15 3.394629000    112.105.150.12        192.168.1.129         UDP      157    Source port: 7088  Destination port: 26714

Frame 15: 157 bytes on wire (1256 bits), 157 bytes captured (1256 bits) on interface 0
Ethernet II, Src: Cisco-Li_eb:0a:d9 (20:aa:4b:eb:0a:d9), Dst: IntelCor_40:cb:03 (f8:16:54:40:cb:03)
Internet Protocol Version 4, Src: 112.105.150.12 (112.105.150.12), Dst: 192.168.1.129 (192.168.1.129)
    Version: 4
    Header Length: 20 bytes
    Differentiated Services Field: 0x20 (DSCP 0x08: Class Selector 1; ECN: 0x00: Not-ECT (Not ECN-Capable Transport))
    Total Length: 143
    Identification: 0x4e98 (20120)
    Flags: 0x00
    Fragment offset: 0
    Time to live: 109
    Protocol: UDP (17)
    Header checksum: 0x3607 [validation disabled]
    Source: 112.105.150.12 (112.105.150.12)
    Destination: 192.168.1.129 (192.168.1.129)
    [Source GeoIP: Unknown]
    [Destination GeoIP: Unknown]
User Datagram Protocol, Src Port: 7088 (7088), Dst Port: 26714 (26714)
Data (115 bytes)

0000  64 31 3a 61 64 32 3a 69 64 32 30 3a b2 bd c2 a9   d1:ad2:id20:....
0010  d8 ff 6e cf f2 f5 3e 2b 84 cd 74 c8 e3 c2 81 d3   ..n...>+..t.....
0020  39 3a 69 6e 66 6f 5f 68 61 73 68 32 30 3a 4b 89   9:info_hash20:K.
0030  aa a4 55 d3 d6 a0 9b e5 be d0 27 21 e6 4b f8 6d   ..U.......'!.K.m
0040  27 f9 36 3a 6e 6f 73 65 65 64 69 31 65 65 31 3a   '.6:noseedi1ee1:
0050  71 39 3a 67 65 74 5f 70 65 65 72 73 31 3a 74 32   q9:get_peers1:t2
0060  3a 2b a3 31 3a 76 34 3a 4c 54 01 00 31 3a 79 31   :+.1:v4:LT..1:y1
0070  3a 71 65                                          :qe

No.     Time           Source                Destination           Protocol Length Info
     16 3.394775000    192.168.1.129         112.105.150.12        UDP      359    Source port: 26714  Destination port: 7088

Frame 16: 359 bytes on wire (2872 bits), 359 bytes captured (2872 bits) on interface 0
Ethernet II, Src: IntelCor_40:cb:03 (f8:16:54:40:cb:03), Dst: Cisco-Li_eb:0a:d9 (20:aa:4b:eb:0a:d9)
Internet Protocol Version 4, Src: 192.168.1.129 (192.168.1.129), Dst: 112.105.150.12 (112.105.150.12)
    Version: 4
    Header Length: 20 bytes
    Differentiated Services Field: 0x00 (DSCP 0x00: Default; ECN: 0x00: Not-ECT (Not ECN-Capable Transport))
    Total Length: 345
    Identification: 0x1f2a (7978)
    Flags: 0x00
    Fragment offset: 0
    Time to live: 128
    Protocol: UDP (17)
    Header checksum: 0x51cb [validation disabled]
    Source: 192.168.1.129 (192.168.1.129)
    Destination: 112.105.150.12 (112.105.150.12)
    [Source GeoIP: Unknown]
    [Destination GeoIP: Unknown]
User Datagram Protocol, Src Port: 26714 (26714), Dst Port: 7088 (7088)
Data (317 bytes)

0000  64 32 3a 69 70 36 3a 70 69 96 0c 1b b0 31 3a 72   d2:ip6:pi....1:r
0010  64 32 3a 69 64 32 30 3a 4b 40 b5 7d 49 dc ad 4f   d2:id20:K@.}I..O
0020  14 f2 44 40 66 d0 6b c4 30 b7 32 f6 35 3a 6e 6f   ..D@f.k.0.2.5:no
0030  64 65 73 32 30 38 3a 4b 43 ac 8f 83 5a ee 26 91   des208:KC...Z.&.
0040  c1 d4 36 88 b4 24 f7 20 2c 03 0f b0 1f 77 d0 c8   ..6..$. ,....w..
0050  d5 4b 43 cf d2 3b 2a 7e 85 35 d4 98 84 cc 0f 93   .KC..;*~.5......
0060  77 e3 14 33 88 bc 8a 09 53 c8 d5 4b 43 37 66 c7   w..3....S..KC7f.
0070  74 86 57 10 11 c0 75 9d 39 bd 77 a6 1d 42 c5 5d   t.W...u.9.w..B.]
0080  4d f2 26 b0 ff 4b 43 63 0f e9 2d ca 53 73 91 46   M.&..KCc..-.Ss.F
0090  46 60 34 d2 26 7e e2 4d 71 77 c4 ea 86 c8 d5 4b   F`4.&~.Mqw.....K
00a0  42 b5 65 bd 3c 9b 9a 3b ad c2 f7 f1 67 48 8a 04   B.e.<..;....gH..
00b0  03 2f 15 45 f4 28 f7 7f 0b 4b 42 26 28 a0 7c 57   ./.E.(...KB&(.|W
00c0  ac b7 48 45 1e e3 c4 60 ea 69 11 42 e1 d5 d3 22   ..HE...`.i.B..."
00d0  89 f7 b5 4b 42 73 96 e2 16 c9 e7 9a 16 22 e3 c9   ...KBs......."..
00e0  64 8d 42 81 26 b9 4d 25 bb 7d 4d 1a e1 4b 45 a5   d.B.&.M%.}M..KE.
00f0  e4 60 ef af dd f6 ee ad 25 8e 14 b4 ec ec 23 49   .`......%.....#I
0100  be 53 fa f0 1d 40 ec 35 3a 74 6f 6b 65 6e 32 30   .S...@.5:token20
0110  3a 4d 39 d6 76 03 3b de fb 5e a6 6c f9 06 18 b4   :M9.v.;..^.l....
0120  9f 14 ae a8 d9 65 31 3a 74 32 3a 2b a3 31 3a 76   .....e1:t2:+.1:v
0130  34 3a 55 54 a1 9d 31 3a 79 31 3a 72 65            4:UT..1:y1:re

No.     Time           Source                Destination           Protocol Length Info
     17 4.403174000    114.24.38.82          192.168.1.129         UDP      220    Source port: 7804  Destination port: 26714

Frame 17: 220 bytes on wire (1760 bits), 220 bytes captured (1760 bits) on interface 0
Ethernet II, Src: Cisco-Li_eb:0a:d9 (20:aa:4b:eb:0a:d9), Dst: IntelCor_40:cb:03 (f8:16:54:40:cb:03)
Internet Protocol Version 4, Src: 114.24.38.82 (114.24.38.82), Dst: 192.168.1.129 (192.168.1.129)
    Version: 4
    Header Length: 20 bytes
    Differentiated Services Field: 0x20 (DSCP 0x08: Class Selector 1; ECN: 0x00: Not-ECT (Not ECN-Capable Transport))
    Total Length: 206
    Identification: 0x4c9f (19615)
    Flags: 0x00
    Fragment offset: 0
    Time to live: 51
    Protocol: UDP (17)
    Header checksum: 0xdfcc [validation disabled]
    Source: 114.24.38.82 (114.24.38.82)
    Destination: 192.168.1.129 (192.168.1.129)
    [Source GeoIP: Unknown]
    [Destination GeoIP: Unknown]
User Datagram Protocol, Src Port: 7804 (7804), Dst Port: 26714 (26714)
Data (178 bytes)

0000  64 31 3a 61 64 32 3a 69 64 32 30 3a 69 0b 4e 9f   d1:ad2:id20:i.N.
0010  93 48 6d 73 0f 25 c2 a4 2d 87 8b 20 22 a2 01 08   .Hms.%..-.. "...
0020  31 32 3a 69 6d 70 6c 69 65 64 5f 70 6f 72 74 69   12:implied_porti
0030  31 65 39 3a 69 6e 66 6f 5f 68 61 73 68 32 30 3a   1e9:info_hash20:
0040  4b 40 b1 4a 74 06 1a c7 e6 34 76 e9 07 3d b6 9e   K@.Jt....4v..=..
0050  85 5f 68 3f 34 3a 70 6f 72 74 69 37 38 30 34 65   ._h?4:porti7804e
0060  34 3a 73 65 65 64 69 31 65 35 3a 74 6f 6b 65 6e   4:seedi1e5:token
0070  32 30 3a ab 46 c2 53 5b b6 3c 74 a6 e3 b7 01 ab   20:.F.S[.<t.....
0080  28 6c e5 af 8f 99 60 65 31 3a 71 31 33 3a 61 6e   (l....`e1:q13:an
0090  6e 6f 75 6e 63 65 5f 70 65 65 72 31 3a 74 32 3a   nounce_peer1:t2:
00a0  28 ea 31 3a 76 34 3a 4c 54 01 00 31 3a 79 31 3a   (.1:v4:LT..1:y1:
00b0  71 65                                             qe

No.     Time           Source                Destination           Protocol Length Info
     18 4.403305000    192.168.1.129         114.24.38.82          UDP      110    Source port: 26714  Destination port: 7804

Frame 18: 110 bytes on wire (880 bits), 110 bytes captured (880 bits) on interface 0
Ethernet II, Src: IntelCor_40:cb:03 (f8:16:54:40:cb:03), Dst: Cisco-Li_eb:0a:d9 (20:aa:4b:eb:0a:d9)
Internet Protocol Version 4, Src: 192.168.1.129 (192.168.1.129), Dst: 114.24.38.82 (114.24.38.82)
    Version: 4
    Header Length: 20 bytes
    Differentiated Services Field: 0x00 (DSCP 0x00: Default; ECN: 0x00: Not-ECT (Not ECN-Capable Transport))
    Total Length: 96
    Identification: 0x1f2b (7979)
    Flags: 0x00
    Fragment offset: 0
    Time to live: 128
    Protocol: UDP (17)
    Header checksum: 0xc0ce [validation disabled]
    Source: 192.168.1.129 (192.168.1.129)
    Destination: 114.24.38.82 (114.24.38.82)
    [Source GeoIP: Unknown]
    [Destination GeoIP: Unknown]
User Datagram Protocol, Src Port: 26714 (26714), Dst Port: 7804 (7804)
Data (68 bytes)

0000  64 32 3a 69 70 36 3a 72 18 26 52 1e 7c 31 3a 72   d2:ip6:r.&R.|1:r
0010  64 32 3a 69 64 32 30 3a 4b 40 b5 7d 49 dc ad 4f   d2:id20:K@.}I..O
0020  14 f2 44 40 66 d0 6b c4 30 b7 32 f6 65 31 3a 74   ..D@f.k.0.2.e1:t
0030  32 3a 28 ea 31 3a 76 34 3a 55 54 a1 9d 31 3a 79   2:(.1:v4:UT..1:y
0040  31 3a 72 65                                       1:re

No.     Time           Source                Destination           Protocol Length Info
     19 4.771543000    fe80::810b:10f:40b7:c58f ff02::c               SSDP     208    M-SEARCH * HTTP/1.1 

Frame 19: 208 bytes on wire (1664 bits), 208 bytes captured (1664 bits) on interface 0
Ethernet II, Src: IntelCor_40:cb:03 (f8:16:54:40:cb:03), Dst: IPv6mcast_0c (33:33:00:00:00:0c)
Internet Protocol Version 6, Src: fe80::810b:10f:40b7:c58f (fe80::810b:10f:40b7:c58f), Dst: ff02::c (ff02::c)
User Datagram Protocol, Src Port: 53709 (53709), Dst Port: 1900 (1900)
Hypertext Transfer Protocol

No.     Time           Source                Destination           Protocol Length Info
     20 7.772826000    fe80::810b:10f:40b7:c58f ff02::c               SSDP     208    M-SEARCH * HTTP/1.1 

Frame 20: 208 bytes on wire (1664 bits), 208 bytes captured (1664 bits) on interface 0
Ethernet II, Src: IntelCor_40:cb:03 (f8:16:54:40:cb:03), Dst: IPv6mcast_0c (33:33:00:00:00:0c)
Internet Protocol Version 6, Src: fe80::810b:10f:40b7:c58f (fe80::810b:10f:40b7:c58f), Dst: ff02::c (ff02::c)
User Datagram Protocol, Src Port: 53709 (53709), Dst Port: 1900 (1900)
Hypertext Transfer Protocol

No.     Time           Source                Destination           Protocol Length Info
     21 8.073876000    2601:1c0:8201:853a:653f:b917:f053:1000 2607:f8b0:400a:805::100c SSL      75     Continuation Data

Frame 21: 75 bytes on wire (600 bits), 75 bytes captured (600 bits) on interface 0
Ethernet II, Src: IntelCor_40:cb:03 (f8:16:54:40:cb:03), Dst: Cisco-Li_eb:0a:d9 (20:aa:4b:eb:0a:d9)
Internet Protocol Version 6, Src: 2601:1c0:8201:853a:653f:b917:f053:1000 (2601:1c0:8201:853a:653f:b917:f053:1000), Dst: 2607:f8b0:400a:805::100c (2607:f8b0:400a:805::100c)
Transmission Control Protocol, Src Port: 49835 (49835), Dst Port: 443 (443), Seq: 1, Ack: 1, Len: 1
Secure Sockets Layer

No.     Time           Source                Destination           Protocol Length Info
     22 8.094285000    2607:f8b0:400a:805::100c 2601:1c0:8201:853a:653f:b917:f053:1000 TCP      86     443→49835 [ACK] Seq=1 Ack=2 Win=251 Len=0 SLE=1 SRE=2

Frame 22: 86 bytes on wire (688 bits), 86 bytes captured (688 bits) on interface 0
Ethernet II, Src: Cisco-Li_eb:0a:d9 (20:aa:4b:eb:0a:d9), Dst: IntelCor_40:cb:03 (f8:16:54:40:cb:03)
Internet Protocol Version 6, Src: 2607:f8b0:400a:805::100c (2607:f8b0:400a:805::100c), Dst: 2601:1c0:8201:853a:653f:b917:f053:1000 (2601:1c0:8201:853a:653f:b917:f053:1000)
Transmission Control Protocol, Src Port: 443 (443), Dst Port: 49835 (49835), Seq: 1, Ack: 2, Len: 0

No.     Time           Source                Destination           Protocol Length Info
     23 8.423894000    2601:1c0:8201:853a:653f:b917:f053:1000 2607:f8b0:400a:804::1003 SSL      75     Continuation Data

Frame 23: 75 bytes on wire (600 bits), 75 bytes captured (600 bits) on interface 0
Ethernet II, Src: IntelCor_40:cb:03 (f8:16:54:40:cb:03), Dst: Cisco-Li_eb:0a:d9 (20:aa:4b:eb:0a:d9)
Internet Protocol Version 6, Src: 2601:1c0:8201:853a:653f:b917:f053:1000 (2601:1c0:8201:853a:653f:b917:f053:1000), Dst: 2607:f8b0:400a:804::1003 (2607:f8b0:400a:804::1003)
Transmission Control Protocol, Src Port: 49837 (49837), Dst Port: 443 (443), Seq: 1, Ack: 1, Len: 1
Secure Sockets Layer

No.     Time           Source                Destination           Protocol Length Info
     24 8.441304000    2607:f8b0:400a:804::1003 2601:1c0:8201:853a:653f:b917:f053:1000 TCP      86     443→49837 [ACK] Seq=1 Ack=2 Win=242 Len=0 SLE=1 SRE=2

Frame 24: 86 bytes on wire (688 bits), 86 bytes captured (688 bits) on interface 0
Ethernet II, Src: Cisco-Li_eb:0a:d9 (20:aa:4b:eb:0a:d9), Dst: IntelCor_40:cb:03 (f8:16:54:40:cb:03)
Internet Protocol Version 6, Src: 2607:f8b0:400a:804::1003 (2607:f8b0:400a:804::1003), Dst: 2601:1c0:8201:853a:653f:b917:f053:1000 (2601:1c0:8201:853a:653f:b917:f053:1000)
Transmission Control Protocol, Src Port: 443 (443), Dst Port: 49837 (49837), Seq: 1, Ack: 2, Len: 0

No.     Time           Source                Destination           Protocol Length Info
     25 8.463833000    2601:1c0:8201:853a:653f:b917:f053:1000 2607:f8b0:400a:807::200e SSL      75     Continuation Data

Frame 25: 75 bytes on wire (600 bits), 75 bytes captured (600 bits) on interface 0
Ethernet II, Src: IntelCor_40:cb:03 (f8:16:54:40:cb:03), Dst: Cisco-Li_eb:0a:d9 (20:aa:4b:eb:0a:d9)
Internet Protocol Version 6, Src: 2601:1c0:8201:853a:653f:b917:f053:1000 (2601:1c0:8201:853a:653f:b917:f053:1000), Dst: 2607:f8b0:400a:807::200e (2607:f8b0:400a:807::200e)
Transmission Control Protocol, Src Port: 49831 (49831), Dst Port: 443 (443), Seq: 1, Ack: 1, Len: 1
Secure Sockets Layer

No.     Time           Source                Destination           Protocol Length Info
     26 8.487194000    2607:f8b0:400a:807::200e 2601:1c0:8201:853a:653f:b917:f053:1000 TCP      86     443→49831 [ACK] Seq=1 Ack=2 Win=265 Len=0 SLE=1 SRE=2

Frame 26: 86 bytes on wire (688 bits), 86 bytes captured (688 bits) on interface 0
Ethernet II, Src: Cisco-Li_eb:0a:d9 (20:aa:4b:eb:0a:d9), Dst: IntelCor_40:cb:03 (f8:16:54:40:cb:03)
Internet Protocol Version 6, Src: 2607:f8b0:400a:807::200e (2607:f8b0:400a:807::200e), Dst: 2601:1c0:8201:853a:653f:b917:f053:1000 (2601:1c0:8201:853a:653f:b917:f053:1000)
Transmission Control Protocol, Src Port: 443 (443), Dst Port: 49831 (49831), Seq: 1, Ack: 2, Len: 0

No.     Time           Source                Destination           Protocol Length Info
     27 8.556286000    2601:1c0:8201:853a:653f:b917:f053:1000 2607:f8b0:400a:804::1003 SSL      75     Continuation Data

Frame 27: 75 bytes on wire (600 bits), 75 bytes captured (600 bits) on interface 0
Ethernet II, Src: IntelCor_40:cb:03 (f8:16:54:40:cb:03), Dst: Cisco-Li_eb:0a:d9 (20:aa:4b:eb:0a:d9)
Internet Protocol Version 6, Src: 2601:1c0:8201:853a:653f:b917:f053:1000 (2601:1c0:8201:853a:653f:b917:f053:1000), Dst: 2607:f8b0:400a:804::1003 (2607:f8b0:400a:804::1003)
Transmission Control Protocol, Src Port: 49838 (49838), Dst Port: 443 (443), Seq: 1, Ack: 1, Len: 1
Secure Sockets Layer

No.     Time           Source                Destination           Protocol Length Info
     28 8.573874000    2607:f8b0:400a:804::1003 2601:1c0:8201:853a:653f:b917:f053:1000 TCP      86     443→49838 [ACK] Seq=1 Ack=2 Win=267 Len=0 SLE=1 SRE=2

Frame 28: 86 bytes on wire (688 bits), 86 bytes captured (688 bits) on interface 0
Ethernet II, Src: Cisco-Li_eb:0a:d9 (20:aa:4b:eb:0a:d9), Dst: IntelCor_40:cb:03 (f8:16:54:40:cb:03)
Internet Protocol Version 6, Src: 2607:f8b0:400a:804::1003 (2607:f8b0:400a:804::1003), Dst: 2601:1c0:8201:853a:653f:b917:f053:1000 (2601:1c0:8201:853a:653f:b917:f053:1000)
Transmission Control Protocol, Src Port: 443 (443), Dst Port: 49838 (49838), Seq: 1, Ack: 2, Len: 0

No.     Time           Source                Destination           Protocol Length Info
     29 9.606344000    2601:1c0:8201:853a:653f:b917:f053:1000 2607:f8b0:400e:c03::69 TLSv1.2  75     Continuation Data

Frame 29: 75 bytes on wire (600 bits), 75 bytes captured (600 bits) on interface 0
Ethernet II, Src: IntelCor_40:cb:03 (f8:16:54:40:cb:03), Dst: Cisco-Li_eb:0a:d9 (20:aa:4b:eb:0a:d9)
Internet Protocol Version 6, Src: 2601:1c0:8201:853a:653f:b917:f053:1000 (2601:1c0:8201:853a:653f:b917:f053:1000), Dst: 2607:f8b0:400e:c03::69 (2607:f8b0:400e:c03::69)
Transmission Control Protocol, Src Port: 49834 (49834), Dst Port: 443 (443), Seq: 1, Ack: 1, Len: 1
Secure Sockets Layer

No.     Time           Source                Destination           Protocol Length Info
     30 9.641294000    2607:f8b0:400e:c03::69 2601:1c0:8201:853a:653f:b917:f053:1000 TCP      86     443→49834 [ACK] Seq=1 Ack=2 Win=432 Len=0 SLE=1 SRE=2

Frame 30: 86 bytes on wire (688 bits), 86 bytes captured (688 bits) on interface 0
Ethernet II, Src: Cisco-Li_eb:0a:d9 (20:aa:4b:eb:0a:d9), Dst: IntelCor_40:cb:03 (f8:16:54:40:cb:03)
Internet Protocol Version 6, Src: 2607:f8b0:400e:c03::69 (2607:f8b0:400e:c03::69), Dst: 2601:1c0:8201:853a:653f:b917:f053:1000 (2601:1c0:8201:853a:653f:b917:f053:1000)
Transmission Control Protocol, Src Port: 443 (443), Dst Port: 49834 (49834), Seq: 1, Ack: 2, Len: 0

No.     Time           Source                Destination           Protocol Length Info
